{
  "id": "gtfo-openvpn-file-read",
  "name": "GTFOBins · openvpn (file-read)",
  "command": "openvpn --config /path/to/input-file",
  "description": "Use openvpn to file read via GTFOBins.",
  "platform": "linux",
  "tags": [
    "gtfobins",
    "openvpn",
    "file-read"
  ],
  "source": "gtfobins",
  "source_url": "https://gtfobins.github.io/gtfobins/openvpn/#file-read",
  "upstream_id": "openvpn/file-read/0",
  "category": "gtfobins",
  "subcategory": "file-read",
  "references": [
    {
      "title": "GTFOBins",
      "url": "https://gtfobins.github.io/gtfobins/openvpn/"
    }
  ]
}
