{
  "id": "gtfo-code-upload",
  "name": "GTFOBins · code (upload)",
  "command": "code tunnel --name xxxxxx",
  "description": "Use code to upload via GTFOBins.",
  "platform": "linux",
  "tags": [
    "gtfobins",
    "code",
    "upload"
  ],
  "source": "gtfobins",
  "source_url": "https://gtfobins.github.io/gtfobins/code/#upload",
  "upstream_id": "code/upload/0",
  "category": "gtfobins",
  "subcategory": "file-upload",
  "references": [
    {
      "title": "GTFOBins",
      "url": "https://gtfobins.github.io/gtfobins/code/"
    }
  ]
}
