{
  "id": "gtfo-cat-file-read",
  "name": "GTFOBins · cat (file-read)",
  "command": "cat /path/to/input-file",
  "description": "Use cat to file read via GTFOBins.",
  "platform": "linux",
  "tags": [
    "gtfobins",
    "cat",
    "file-read"
  ],
  "source": "gtfobins",
  "source_url": "https://gtfobins.github.io/gtfobins/cat/#file-read",
  "upstream_id": "cat/file-read/0",
  "category": "gtfobins",
  "subcategory": "file-read",
  "references": [
    {
      "title": "GTFOBins",
      "url": "https://gtfobins.github.io/gtfobins/cat/"
    }
  ]
}
