{
  "id": "gtfo-mysql-library-load",
  "name": "GTFOBins · mysql (library-load)",
  "command": "mysql --default-auth ../../../../../path/to/lib",
  "description": "Use mysql to library load via GTFOBins.",
  "platform": "linux",
  "tags": [
    "gtfobins",
    "mysql",
    "library-load"
  ],
  "source": "gtfobins",
  "source_url": "https://gtfobins.github.io/gtfobins/mysql/#library-load",
  "upstream_id": "mysql/library-load/0",
  "category": "gtfobins",
  "subcategory": "library-load",
  "references": [
    {
      "title": "GTFOBins",
      "url": "https://gtfobins.github.io/gtfobins/mysql/"
    }
  ]
}
