{
  "id": "gtfo-lwp-download-file-write-1",
  "name": "GTFOBins · lwp-download (file-write) #1",
  "command": "echo DATA >/path/to/temp-file\nlwp-download file:///path/to/temp-file /path/to/output-file",
  "description": "Use lwp-download to file write via GTFOBins.",
  "platform": "linux",
  "tags": [
    "gtfobins",
    "lwp-download",
    "file-write"
  ],
  "source": "gtfobins",
  "source_url": "https://gtfobins.github.io/gtfobins/lwp-download/#file-write",
  "upstream_id": "lwp-download/file-write/0",
  "category": "gtfobins",
  "subcategory": "file-write",
  "references": [
    {
      "title": "GTFOBins",
      "url": "https://gtfobins.github.io/gtfobins/lwp-download/"
    }
  ]
}
