{
  "id": "gtfo-troff-file-read",
  "name": "GTFOBins · troff (file-read)",
  "command": "troff /path/to/input-file",
  "description": "Use troff to file read via GTFOBins.",
  "platform": "linux",
  "tags": [
    "gtfobins",
    "troff",
    "file-read"
  ],
  "source": "gtfobins",
  "source_url": "https://gtfobins.github.io/gtfobins/troff/#file-read",
  "upstream_id": "troff/file-read/0",
  "category": "gtfobins",
  "subcategory": "file-read",
  "references": [
    {
      "title": "GTFOBins",
      "url": "https://gtfobins.github.io/gtfobins/troff/"
    }
  ]
}
