{
  "id": "gtfo-xpad-file-read",
  "name": "GTFOBins · xpad (file-read)",
  "command": "xpad -f /path/to/input-file",
  "description": "Use xpad to file read via GTFOBins.",
  "platform": "linux",
  "tags": [
    "gtfobins",
    "xpad",
    "file-read"
  ],
  "source": "gtfobins",
  "source_url": "https://gtfobins.github.io/gtfobins/xpad/#file-read",
  "upstream_id": "xpad/file-read/0",
  "category": "gtfobins",
  "subcategory": "file-read",
  "references": [
    {
      "title": "GTFOBins",
      "url": "https://gtfobins.github.io/gtfobins/xpad/"
    }
  ]
}
